{
  "$schema": "https://json-schema.org/draft/2020-12/schema",
  "$id": "https://github.com/sapoepsilon/pragmatic-skills/blob/main/schema/plugin.schema.json",
  "title": "Claude Code plugin.json (pragmatic-skills subset)",
  "type": "object",
  "additionalProperties": true,
  "required": ["name", "description", "version"],
  "properties": {
    "name": {
      "type": "string",
      "pattern": "^[a-z][a-z0-9-]{1,38}[a-z0-9]$"
    },
    "description": { "type": "string", "minLength": 10, "maxLength": 500 },
    "version": {
      "type": "string",
      "pattern": "^\\d+\\.\\d+\\.\\d+(?:-[A-Za-z0-9.-]+)?(?:\\+[A-Za-z0-9.-]+)?$"
    },
    "author": {
      "type": "object",
      "required": ["name"],
      "properties": {
        "name":  { "type": "string" },
        "email": { "type": "string", "format": "email" },
        "url":   { "type": "string", "format": "uri" }
      }
    },
    "license":    { "type": "string" },
    "homepage":   { "type": "string", "format": "uri" },
    "repository": { "type": "string" },
    "keywords": {
      "type": "array",
      "items": { "type": "string", "minLength": 1, "maxLength": 40 },
      "uniqueItems": true,
      "maxItems": 20
    }
  }
}
