{
  "name": "verify-to-e2e",
  "description": "Verify a feature by driving the real running app (simulator/emulator/browser/CLI), then codify that exact check into a reusable end-to-end test wired into the project's test harness.",
  "version": "0.1.0",
  "author": {
    "name": "sapoepsilon"
  },
  "license": "MIT",
  "homepage": "https://github.com/sapoepsilon/pragmatic-skills/tree/main/plugins/verify-to-e2e",
  "repository": "https://github.com/sapoepsilon/pragmatic-skills",
  "keywords": ["testing", "e2e", "verification", "mcp", "qa", "integration-test"]
}
