{
  "name": "pragmatic",
  "description": "Bundle of all pragmatic-skills. Currently includes: muchotexto, vault-session (resume + save).",
  "version": "0.3.0",
  "author": {
    "name": "sapoepsilon"
  },
  "license": "MIT",
  "homepage": "https://github.com/sapoepsilon/pragmatic-skills",
  "repository": "https://github.com/sapoepsilon/pragmatic-skills",
  "keywords": ["bundle", "skills"]
}
