{
  "name": "muchotexto",
  "description": "Answer in the minimum sentences that carry the meaning. Start at one and proactively grow by +1 only when a fact, caveat, or step would otherwise be lost.",
  "version": "0.2.0",
  "author": {
    "name": "sapoepsilon"
  },
  "license": "MIT",
  "homepage": "https://github.com/sapoepsilon/pragmatic-skills/tree/main/plugins/muchotexto",
  "repository": "https://github.com/sapoepsilon/pragmatic-skills",
  "keywords": ["brevity", "communication", "meta", "tldr"]
}
